{
  "game": "SnowRunner",
  "process": "SnowRunner",
  "gameVersion": "Steam build, tested 2026-08-16",
  "revision": 2,
  "cheats": [
    {
      "name": "Infinite Fuel",
      "category": "Vehicle",
      "description": "Holds the active truck's fuel so it never drains. Enable it with a full-ish tank; it freezes fuel at whatever level it's at when you turn it on. Durable pointer chain found in-house (range-scan the fuel float, freeze, pointer-scan); verified across two relaunches.",
      "type": "freeze",
      "valueType": "float",
      "resolveEachTick": true,
      "resolve": {
        "kind": "pointer",
        "module": "SnowRunner.exe",
        "moduleOffset": "0x2AA17F0",
        "offsets": ["0x28", "0x5E8"]
      }
    },
    {
      "name": "No Engine Damage",
      "category": "Vehicle",
      "description": "Keeps the active truck's accumulated engine damage at zero. Found in-house by scanning increasing damage rather than decreasing integrity; verified across multiple SnowRunner relaunches.",
      "type": "freeze",
      "valueType": "int",
      "value": "0",
      "resolveEachTick": true,
      "resolve": {
        "kind": "pointer",
        "module": "SnowRunner.exe",
        "moduleOffset": "0x2A8EDD8",
        "offsets": ["0x8", "0x150", "0x38"]
      }
    },
    {
      "name": "No Transmission Damage",
      "category": "Vehicle",
      "description": "Keeps the active truck's accumulated transmission damage at zero. Found in-house as the engine accumulator's sibling field and confirmed by restoring 180/180 and blocking further transmission damage.",
      "type": "freeze",
      "valueType": "int",
      "value": "0",
      "resolveEachTick": true,
      "resolve": {
        "kind": "pointer",
        "module": "SnowRunner.exe",
        "moduleOffset": "0x2A8EDD8",
        "offsets": ["0x8", "0x148", "0x38"]
      }
    }
  ]
}
